{
  "$schema": "https://json-schema.org/draft/2020-12/schema",
  "$id": "https://vc4qi.example/schemas/rm/1/status-list.json",
  "title": "Bitstring Status List credential for RM v1 fixtures",
  "description": "Experimental VC4QI RM binding v1 fixture schema. Not an external standard.",
  "type": "object",
  "required": [
    "@context",
    "id",
    "type",
    "issuer",
    "validFrom",
    "validUntil",
    "credentialSchema",
    "credentialSubject"
  ],
  "properties": {
    "@context": {
      "const": [
        "https://www.w3.org/ns/credentials/v2"
      ]
    },
    "id": {
      "type": "string",
      "format": "uri"
    },
    "type": {
      "const": [
        "VerifiableCredential",
        "BitstringStatusListCredential"
      ]
    },
    "issuer": {
      "type": "string",
      "format": "uri"
    },
    "validFrom": {
      "type": "string",
      "pattern": "^\\d{4}-\\d{2}-\\d{2}T\\d{2}:\\d{2}:\\d{2}(\\.\\d{1,9})?(Z|[+-]\\d{2}:\\d{2})$"
    },
    "validUntil": {
      "type": "string",
      "pattern": "^\\d{4}-\\d{2}-\\d{2}T\\d{2}:\\d{2}:\\d{2}(\\.\\d{1,9})?(Z|[+-]\\d{2}:\\d{2})$"
    },
    "credentialSchema": {
      "type": "object",
      "required": [
        "id",
        "type"
      ],
      "properties": {
        "id": {
          "const": "https://vc4qi.example/schemas/rm/1/status-list.json"
        },
        "type": {
          "const": "JsonSchema"
        }
      },
      "additionalProperties": false
    },
    "credentialSubject": {
      "type": "object",
      "required": [
        "id",
        "type",
        "statusPurpose",
        "encodedList"
      ],
      "properties": {
        "id": {
          "type": "string",
          "format": "uri"
        },
        "type": {
          "const": "BitstringStatusList"
        },
        "statusPurpose": {
          "enum": [
            "revocation",
            "suspension"
          ]
        },
        "encodedList": {
          "type": "string",
          "pattern": "^u[A-Za-z0-9_-]+$"
        }
      },
      "additionalProperties": false
    },
    "proof": {
      "type": "object",
      "required": [
        "type",
        "cryptosuite",
        "proofPurpose",
        "verificationMethod",
        "created",
        "proofValue"
      ],
      "properties": {
        "type": {
          "const": "DataIntegrityProof"
        },
        "cryptosuite": {
          "const": "eddsa-rdfc-2022"
        },
        "proofPurpose": {
          "const": "assertionMethod"
        },
        "verificationMethod": {
          "type": "string",
          "format": "uri"
        },
        "created": {
          "type": "string",
          "pattern": "^\\d{4}-\\d{2}-\\d{2}T\\d{2}:\\d{2}:\\d{2}(\\.\\d{1,9})?(Z|[+-]\\d{2}:\\d{2})$"
        },
        "proofValue": {
          "type": "string",
          "pattern": "^z[1-9A-HJ-NP-Za-km-z]+$"
        }
      },
      "additionalProperties": false
    }
  },
  "additionalProperties": false
}
