{
  "@context": [
    "https://www.w3.org/ns/credentials/v2"
  ],
  "id": "https://lab.vc4qi.example/status/1",
  "type": [
    "VerifiableCredential",
    "BitstringStatusListCredential"
  ],
  "issuer": "https://lab.vc4qi.example/controller",
  "validFrom": "2026-09-01T00:00:00Z",
  "validUntil": "2027-09-01T00:00:00Z",
  "credentialSchema": {
    "id": "https://vc4qi.example/schemas/rm/1/status-list.json",
    "type": "JsonSchema"
  },
  "credentialSubject": {
    "id": "https://lab.vc4qi.example/status/1#list",
    "type": "BitstringStatusList",
    "statusPurpose": "revocation",
    "encodedList": "uH4sIAAAAAAACA-3BMQEAAADCoPVPbQwfoAAAAAAAAAAAAAAAAAAAAIC3AYbSVKsAQAAA"
  },
  "proof": {
    "type": "DataIntegrityProof",
    "cryptosuite": "eddsa-rdfc-2022",
    "proofPurpose": "assertionMethod",
    "verificationMethod": "https://lab.vc4qi.example/controller#key-1",
    "created": "2026-09-01T00:00:00Z",
    "proofValue": "z2S9Mfg5j7WnfAi85JnVsUhLnE2Mdemzts5zZQ99w5JZUsviKBKcQxgJR3eJQbzUfNqHmyL2dWyqLJM3dSYMDmwmV"
  }
}
